{
  "schema_version": "0.1",
  "generator_agent_id": "motionloom-generator-v1",
  "sequence_id": "hero-walk-v1",
  "action_id": "walk",
  "frame_id": "walk.01",
  "frame_index": 1,
  "image": "assets/hero-frame-01.png",
  "image_sha256": "1eaf21df83ed49e490ceb7db1e1a14c58e5227bcb4f1fd79a70e8ad3ee7d38ad",
  "identity_lock_sha256": "59d6b09622b19839b8c9342fb043965ea3f515c8979d769284d413f60a5f7e2d",
  "verifier": {
    "verifier_id": "motionloom-separation-verifier-v1",
    "expected_action": "walk",
    "top_competitor": "jump",
    "margin": 0.39,
    "threshold": 0.2,
    "status": "pass",
    "method": "independent-action-rubric-v1"
  },
  "approval": false
}
