{
  "schema_version": "0.1",
  "generator_agent_id": "motionloom-generator-v1",
  "sequence_id": "hero-walk-v1",
  "action_id": "walk",
  "frame_id": "walk.00",
  "frame_index": 0,
  "image": "assets/hero-frame-00.png",
  "image_sha256": "75ce90653a01a23bcfab1aef83647d6364d3edbf6e4a44b84c635338c12b9248",
  "identity_lock_sha256": "59d6b09622b19839b8c9342fb043965ea3f515c8979d769284d413f60a5f7e2d",
  "verifier": {
    "verifier_id": "motionloom-separation-verifier-v1",
    "expected_action": "walk",
    "top_competitor": "run",
    "margin": 0.42,
    "threshold": 0.2,
    "status": "pass",
    "method": "independent-action-rubric-v1"
  },
  "approval": false
}
